<?xml version="1.0" encoding="UTF-8"?>
<!--a
<zapatos xmlns:xsi="http://www.w3.org/2001/XMLSchema-instance" xsi:noNamespaceSchemaLocation="file:/C:/Users/casty/OneDrive/Escritorio/dam1/lmxi_v2/TEMA%205/boletines/repasoExamen/boletin25.xsd">
  <zapato>Mocasín</zapato>
  <color>azul</color>
</zapatos>
-->

<!--b
<usuario xmlns:xsi="http://www.w3.org/2001/XMLSchema-instance" xsi:noNamespaceSchemaLocation="file:/C:/Users/casty/OneDrive/Escritorio/dam1/lmxi_v2/TEMA%205/boletines/repasoExamen/boletin25.xsd">
  <nombreUsuario>Martina García</nombreUsuario>
  <claveUsuario>1234jdhe</claveUsuario>
</usuario>
-->

<!--c
<usuario xmlns:xsi="http://www.w3.org/2001/XMLSchema-instance" xsi:noNamespaceSchemaLocation="file:/C:/Users/casty/OneDrive/Escritorio/dam1/lmxi_v2/TEMA%205/boletines/repasoExamen/boletin25.xsd">
  <nombreUsuario>Martina García</nombreUsuario>
  <claveUsuario>djdjdjdjd</claveUsuario>
</usuario>
-->

<!--d
<fichero xmlns:xsi="http://www.w3.org/2001/XMLSchema-instance" xsi:noNamespaceSchemaLocation="file:/C:/Users/casty/OneDrive/Escritorio/dam1/lmxi_v2/TEMA%205/boletines/repasoExamen/boletin25.xsd">
  <nombreFichero>Ek392jdw</nombreFichero>
  <extension>xml</extension>
</fichero>
-->

<!--e
<alumnos xmlns:xsi="http://www.w3.org/2001/XMLSchema-instance" xsi:noNamespaceSchemaLocation="file:/C:/Users/casty/OneDrive/Escritorio/dam1/lmxi_v2/TEMA%205/boletines/repasoExamen/boletin25.xsd">
<alumno dni="......">
<nombre>Juan Garcia</nombre>
<direccion>
<calle>Avenida de la Fuente</calle>
<numero>6</numero>
<ciudad>.........</ciudad>
<provincia>...........</provincia>
</direccion>
<telefono>924555555</telefono></alumno>
<alumno dni="........">
<nombre>Jose Sanchez</nombre>
<direccion>
<calle>Calle Ancha</calle>
<numero>3</numero>
<ciudad>..........</ciudad>
<provincia>.........</provincia>
</direccion>
<telefono>924550000</telefono>
</alumno>
</alumnos>
-->
<libros xmlns:xsi="http://www.w3.org/2001/XMLSchema-instance" xsi:noNamespaceSchemaLocation="file:/C:/Users/casty/OneDrive/Escritorio/dam1/lmxi_v2/TEMA%205/boletines/repasoExamen/boletin25.xsd">
 <libro>
    <titulo>Los hombres que no amaban a las...</titulo>
    <autor>Stieg Larsson</autor>
    <fecha>2008</fecha>
    <isbn>978-84-233</isbn>
    <editor>Destino</editor>
    <categoria>Ficcion</categoria>
    <stock>Si</stock>
  </libro>
  
  <libro revisor="Luis Rodrigo">
  <titulo>Java a través de los tiempos</titulo>
    <autor>Jesus bobadilla</autor>
    <autor>Adela sancho</autor>
    <fecha>2003</fecha>
    <isbn>978-84-567</isbn>
    <editor>Ra-Ma</editor>
    <categoria>No ficcion</categoria>
    <stock>No</stock>
  </libro>
</libros>
